<?xml version="1.0" encoding="UTF-8" standalone="no"?>
<!DOCTYPE engineconfig SYSTEM "../Engine/engineconfig.dtd">
<engineconfig>
   <write_period>30</write_period>
   <buffer_reserve>3</buffer_reserve>
   <group>
      <name>Vac</name>
      <channel><name>vac1</name><monitor/></channel>
      <channel><name>vac2</name><monitor/><disable/></channel>
      <channel><name>vac3</name><scan>30</scan></channel>
   </group>
   <group>
      <name>RF</name>
      <channel><name>rf1</name><monitor/></channel>
      <channel><name>rf2</name><monitor/></channel>
      <channel><name>rf3</name><scan>30</scan></channel>
   </group>
   <group>
      <name>Test</name>
      <channel><name>test1</name></channel>
   </group>
</engineconfig>
